{
  "iss": "bitacora",
  "sub": "did:keel:abc123",
  "exp": 1735689600,
  "features": [
    "VELA.MAIN",
    "VELA.JIB",
    "VELA.STAY"
  ],
  "min_template_versions": {
    "navigator.core": 12,
    "review": 5
  },
  "allowed_hashes": [
    "0xDEADBEEF...",
    "0xFEEDFACE..."
  ],
  "offline_grace_s": 604800,
  "app_version": ">=1.3.0 <2.0.0",
  "attestation_required": true,
  "audio_challenge": {
    "enabled": true,
    "sr": 16000,
    "dur_ms": 800,
    "window": "hann",
    "bins": 64
  }
}